{"schema_version":1,"minimum_reader_version":"0.4.0","digest":"sha256:6a5328670e7430258bb5d6ba0208b5e72d2cd3a6cf78b0c69e824ecb65f74f6a","project_id":"project-compatibility","generation_id":"generation-compatibility","project_view_digest":"sha256:1111111111111111111111111111111111111111111111111111111111111111","generated_at":"2026-09-04T00:00:00Z","sort_version":"started-at-desc-null-last-provider-session-v1","coverage":{"total":0,"complete":0,"partial":0,"error":0,"unprocessed":0,"source_available":0,"source_unavailable":0,"started_at_known":0,"ended_at_known":0,"usage_known":0},"sessions":[]}
